t/_id,t/__text,h/_id,h/__text,_task,_id,_topic,_BAF,_entailment,_ENTAILMENT,h/_d
2-j3,I never saw a guiltier man in my life. You sat right in court and heard the same thing I did. The man's a dangerous killer.,1-j8,I don't know [if he is guilty].,ARG,1,Act1-TwelveAngryMan,ATTACK,CONTRADICTION,,
3-j8,"He's nineteen years old, [he is too young to be guity].",2-j3,I never saw a guiltier man in my life. You sat right in court and heard the same thing I did. The man's a dangerous killer.,ARG,2,Act1-TwelveAngryMan,ATTACK,CONTRADICTION,,
4-j3,"That's old enough. He knifed his own father, four inches into the chest. An innocent little nineteen-year old kid. They proved it a dozen different ways.",3-j8,"He's nineteen years old, [he is too young to be guity].",ARG,3,Act1-TwelveAngryMan,ATTACK,CONTRADICTION,,
5-j8,It's not so easy for me to raise my hand and send a boy off to die without talking about it first.,1-j8,I don't know [if he il guilty].,ARG,4,Act1-TwelveAngryMan,SUPPORT,,ENTAILMENT,
6-j7,I think the guy is guilty. You couldn't change my mind if you talked for a hundred years.,1-j8,I don't know [if he il guilty].,ARG,5,Act1-TwelveAngryMan,ATTACK,CONTRADICTION,,
7-j8,"This boy has been kicked around all his life. You know, living in a slum, his mother dead since he was nine. That's not a very good head start. He's a tough, angry kid. I think maybe we owe him a few words [before considering him guilty].",6-j7,I think the guy is guilty. You couldn't change my mind if you talked for a hundred years.,ARG,6,Act1-TwelveAngryMan,ATTACK,CONTRADICTION,,
8-j10,"We don't owe him a thing [before considering him guilty]. He got a fair trial. You're not going to tell us that we're supposed to believe him, knowing what he is. I've lived among 'em all my life. You can't believe a word they say.",7-j8,"This boy has been kicked around all his life. You know, living in a slum, his mother dead since he was nine. That's not a very good head start. He's a tough, angry kid. I think maybe we owe him a few words [before considering him guilty].",ARG,7,Act1-TwelveAngryMan,ATTACK,CONTRADICTION,,
9-j9,I don't know that [you can't believe a word they say]. Since when is dishonesty a group characteristic? You have no monopoly on the truth.,8-j10,"We don't owe him a thing [before considering him guilty]. He got a fair trial. You're not going to tell us that we're supposed to believe him, knowing what he is. I've lived among 'em all my life. You can't believe a word they say.",ARG,8,Act1-TwelveAngryMan,ATTACK,CONTRADICTION,,
10-j2,I just think he's guilty. I thought it was obvious. I mean nobody proved otherwise.,1-j8,I don't know [if he il guilty].,ARG,9,Act1-TwelveAngryMan,ATTACK,CONTRADICTION,,
11-j8,Nobody has to prove [that he is not guilty]. The burden of proof is on the prosecution. The defendant doesn't have to open his mouth. That's in the Constitution. The Fifth Amendment.,10-j2,I just think he's guilty. I thought it was obvious. I mean nobody proved otherwise.,ARG,10,Act1-TwelveAngryMan,ATTACK,CONTRADICTION,,
12-j2,I think he was guilty.,11-j8,Nobody has to prove [that he is not guilty]. The burden of proof is on the prosecution. The defendant doesn't have to open his mouth. That's in the Constitution. The Fifth Amendment.,ARG,11,Act1-TwelveAngryMan,ATTACK,UNKNOWN,,
13-j3,"Let's take the old man who lived on the second floor right underneath the room where the murder took place. At ten minutes after twelve on the night of the killing he heard loud noises in the upstairs apartment. He said it sounded like a fight. Then he heard the kid say to his father, ""I'm gonna kill you.!"" A second later he heard a body falling, and he ran to the door of his apartment, looked out, and saw the kid running down the stairs and out of the house. Then he called the police. They found the father with a knife in his chest.",1-j8,I don't know [if he il guilty].,ARG,12,Act1-TwelveAngryMan,ATTACK,CONTRADICTION,,
14-F,"[The man who lived on the second floor right underneath the room where the murder took place at ten minutes after twelve on the night of the killing he heard loud noises in the upstairs apartment. He said it sounded like a fight. Then he heard the kid say to his father, ""I'm gonna kill you.!"" A second later he heard a body falling, and he ran to the door of his apartment, looked out, and saw the kid running down the stairs and out of the house. Then he called the police. They found the father with a knife in his chest].  And the coroner fixed the time of death at around midnight.",13-j3,"Let's take the old man who lived on the second floor right underneath the room where the murder took place. At ten minutes after twelve on the night of the killing he heard loud noises in the upstairs apartment. He said it sounded like a fight. Then he heard the kid say to his father, ""I'm gonna kill you.!"" A second later he heard a body falling, and he ran to the door of his apartment, looked out, and saw the kid running down the stairs and out of the house. Then he called the police. They found the father with a knife in his chest.",ARG,13,Act1-TwelveAngryMan,SUPPORT,,ENTAILMENT,
15-j4,The boy claimed [that while the man who lived on the second floor right underneath the room where the murder took place saw the kid running down the stairs and out of the house] he was at the movies. That's a little ridiculous. He couldn't even remember what pictures he saw.,14-F,[The man who lived on the second floor right underneath the room where the murder took place saw the kid running down the stairs and out of the house]. And the coroner fixed the time of death at around midnight.,ARG,14,Act1-TwelveAngryMan,SUPPORT,,ENTAILMENT,
16-j3,That's right. Did you hear [that the boy couldn't even remember what pictures he saw at the movie]?,15-j4,The boy claimed that he was at the movies. That's a little ridiculous. He couldn't even remember what pictures he saw.,ARG,15,Act1-TwelveAngryMan,SUPPORT,,ENTAILMENT,
17-j10,"[Beside the fact that the boy couldn't even remember what pictures he saw at the movie], what about the woman across the street? If her testimony [to have seen the killing] don't prove [that the boy is guilty], then nothing does.",16-j3,That's right. Did you hear [that the boy couldn't even remember what pictures he saw at the movie]?,ARG,16,Act1-TwelveAngryMan,SUPPORT,,ENTAILMENT,
18-J8,[She saw the killing] through the windows of a passing elevated train [so her testimony is not reliable].,17-j10,"Look, what about the woman across the street? If her testimony [to have seen the killing] don't prove [that the boy is guilty], then nothing does.",ARG,17,Act1-TwelveAngryMan,ATTACK,CONTRADICTION,,
19-J10,They proved in court that you can look through the windows of a passing elevated train at night and see what's happening on the other side. They proved it.,18-J8,[She saw the killing] through the windows of a passing elevated train [so her testimony is not reliable].,ARG,18,Act1-TwelveAngryMan,ATTACK,CONTRADICTION,,
20-J6,"I started to be convinced [about the fact that the guy is guilty], with the testimony from those people across the hall. Didn't they say something about an argument between the father and the boy around seven o'clock that night?",1-j8,I don't know [if he il guilty].,ARG,19,Act1-TwelveAngryMan,ATTACK,CONTRADICTION,,
21-j8,Eight o'clock. They heard the father hit the boy twice and then saw the boy walk angrily out of the house. [It does not prove that the boy killed him].,20-J6,"I started to be convinced [about the fact that the guy is guilty], with the testimony from those people across the hall. Didn't they say something about an argument between the father and the boy around seven o'clock that night?",ARG,20,Act1-TwelveAngryMan,ATTACK,CONTRADICTION,,
22-j7,Look at the kid's record. At fifteen he was in reform school. He stole a car. He's been arrested for mugging. He was picked up for knife-fighting. I think they said he stabbed somebody in the arm. This is a very fine boy.,1-j8,I don't know [if he il guilty].,ARG,21,Act1-TwelveAngryMan,ATTACK,UNKNOWN,,
23-j8,Ever since he was five years old his father beat him up regularly. He used his fists.,22-j7,Look at the kid's record. At fifteen he was in reform school. He stole a car. He's been arrested for mugging. He was picked up for knife-fighting. I think they said he stabbed somebody in the arm. This is a very fine boy.,ARG,22,Act1-TwelveAngryMan,ATTACK,UNKNOWN,,
24-j7,[If I had a kid like that] I would [have beated him]!,23-j8,Ever since he was five years old his father beat him up regularly. He used his fists.,ARG,23,Act1-TwelveAngryMan,ATTACK,UNKNOWN,,
25-j3,"It's the kids. They don't listen. I've got a kid. When he was eight years old, he ran away from a fight. I saw him. I was so ashamed, I told him right out, ""I'm gonna make a man out of you or I'm gonna bust you up into little pieces trying."" When he was fifteen he hit me in the face. He's big, you know. I haven't seen him in three years.",24-j7,[If I had a kid like that] I would [have beated him]!,ARG,24,Act1-TwelveAngryMan,SUPPORT,,ENTAILMENT,
26-j8,"I had a peculiar feeling about this trial. Somehow I felt that the defense counsel never really conducted a thorough cross-examination. I mean, he was appointed by the court to defend the boy. He hardly seemed interested. Too many questions were left unasked.",1-j8,I don't know [if he il guilty].,ARG,25,Act1-TwelveAngryMan,SUPPORT,,ENTAILMENT,
27-j3,"Let's talk about that cute little switchknife. You know, the one that fine, upright kid admitted buying.",26-j8,"I had a peculiar feeling about this trial. Somehow I felt that the defense counsel never really conducted a thorough cross-examination. I mean, he was appointed by the court to defend the boy. He hardly seemed interested. Too many questions were left unasked.",ARG,26,Act1-TwelveAngryMan,ATTACK,UNKNOWN,,
28-j4,"The boy claims that on the way home the switchknife [that he admitted buying] must have fallen through a hole in his coat pocket, that he never saw it again. You know what actually happened. The boy took the knife home and a few hours later stabbed his father with it and even remembered to wipe off the fingerprints.",27-j3,"Let's talk about that cute little switchknife. You know, the one that fine, upright kid admitted buying.",ARG,27,Act1-TwelveAngryMan,SUPPORT,,ENTAILMENT,
29-j8,It's possible that the boy lost the knife and that someone else stabbed his father with a similar knife. It's possible.,28-j4,"The boy claims that on the way home the switchknife [that he admitted buying] must have fallen through a hole in his coat pocket, that he never saw it again. You know what actually happened. The boy took the knife home and a few hours later stabbed his father with it and even remembered to wipe off the fingerprints.",ARG,28,Act1-TwelveAngryMan,ATTACK,CONTRADICTION,,
30-j4,Take a look at that knife. It's a very strange knife. I've never seen one like it before in my life and neither had the storekeeper who sold it to him.,29-j8,It's possible that the boy lost the knife and that someone else stabbed his father with a similar knife. It's possible.,ARG,29,Act1-TwelveAngryMan,ATTACK,UNKNOWN,,
31-j8,I'm not trying to make anyone accept [the hypothesis that the boy lost the knife and that someone else stabbed his father with a similar knife]. I'm just saying it's possible.,30-j4,Take a look at that knife. It's a very strange knife. I've never seen one like it before in my life and neither had the storekeeper who sold it to him.,ARG,30,Act1-TwelveAngryMan,ATTACK,UNKNOWN,,
32-j3,And I'm saying it's not possible [that the boy lost the knife and that someone else stabbed his father with a similar knife].,31-j8,I'm not trying to make anyone accept [the hypothesis that the boy lost the knife and that someone else stabbed his father with a similar knife]. I'm just saying it's possible.,ARG,31,Act1-TwelveAngryMan,ATTACK,CONTRADICTION,,
33-j8,Maybe there are [ten knives like the one used by the boy].,32-j3,And I'm saying it's not possible [that the boy lost the knife and that someone else stabbed his father with a similar knife].,ARG,32,Act1-TwelveAngryMan,ATTACK,UNKNOWN,,
34-j3,The boy lied [about the fact that he lost the knife and that someone else stabbed his father with a similar knife]].,31-j8,I'm not trying to make anyone accept [the hypothesis that the boy lost the knife and that someone else stabbed his father with a similar knife]. I'm just saying it's possible.,ARG,33,Act1-TwelveAngryMan,ATTACK,CONTRADICTION,,
35-j10,Sure [the boy] lied!,34-j3,The boy lied.,ARG,34,Act1-TwelveAngryMan,SUPPORT,,ENTAILMENT,
36-j4,[The boy] lied.,35-j10,Sure [the boy] lied!,ARG,35,Act1-TwelveAngryMan,SUPPORT,,ENTAILMENT,
37-j7,"If you want to be stubborn and hang this jury, [the boy] will be tried again and found guilty, sure as he's born.",1-j8,I don't know [if he is guilty].,ARG,36,Act1-TwelveAngryMan,ATTACK,CONTRADICTION,,
38-j8,You're probably right [the boy will be tried again and found guilty].,37-j7,"If you want to be stubborn and hang this jury, [the boy] will be tried again and found guilty, sure as he's born.",ARG,37,Act1-TwelveAngryMan,SUPPORT,,ENTAILMENT,
39-j9,A man may die [if we say that he is guilty].,38-j8,You're probably right [the boy will be tried again and found guilty].,ARG,38,Act1-TwelveAngryMan,ATTACK,UNKNOWN,,
41-j3,"The old man heard the kid yell, ""I'm gonna kill you"". A second later he heard the father's body falling, and he saw the boy running out of the house fifteen seconds after that.",40-j9,It's a feeling I have [that he is not guilty].,ARG,39,Act2-TwelveAngryMan,ATTACK,CONTRADICTION,,
42-j12,And let's not forget the woman across the street. She looked into the open window and saw the boy stab his father. She saw it. Now if that's not enough for you.,40-j9,It's a feeling I have [that he is not guilty].,ARG,40,Act2-TwelveAngryMan,ATTACK,CONTRADICTION,,
43-j8,[The woman across the street who looked into the open window and saw the boy stab his father]. It's not enough for me [to consider him guilty].,,And let's not forget the woman across the street. She looked into the open window and saw the boy stab his father. She saw it. Now if that's not enough for you.,ARG,41,Act2-TwelveAngryMan,ATTACK,CONTRADICTION,,42-j12
44-j4,"The woman saw the killing through the windows of a moving elevated train. The train had five cars, and she saw it through the windows of the last two.",43-j8,[The woman across the street who looked into the open window and saw the boy stab his father]. It's not enough for me [to consider him guilty].,ARG,42,Act2-TwelveAngryMan,ATTACK,CONTRADICTION,,
45-j8,"An el takes ten seconds to pass a given point or two seconds per car. That el had been going by the old man's window for at least six seconds and maybe more, before the body fell, according to the woman. The old man would have had to hear the boy say, ""I'm going to kill you,"" while the front of the el was roaring past his nose. It's not possible that he could nave heard it.",41-J3,"The old man heard the kid yell, ""I'm gonna kill you."" A second later he heard the father's body falling, and he saw the boy running out of the house fifteen seconds after that.",ARG,43,Act2-TwelveAngryMan,ATTACK,CONTRADICTION,,
46-j3,"[The old man] said the boy yelled [""I'm going to kill you""] out. That's enough for me.",45-j8,"An el takes ten seconds to pass a given point or two seconds per car. That el had been going by the old man's window for at least six seconds and maybe more, before the body fell, according to the woman. The old man would have had to hear the boy say, ""I'm going to kill you,"" while the front of the el was roaring past his nose. It's not possible that he could nave heard it.",ARG,44,Act2-TwelveAngryMan,ATTACK,CONTRADICTION,,
47-j9,"I don't think he could have heard [the old man yelling ""I'm going to kill you""].",46-j3,"[The old man] said the boy yelled [""I'm going to kill you""] out. That's enough for me.",ARG,45,Act2-TwelveAngryMan,ATTACK,CONTRADICTION,,
48-j2,"Maybe he didn't hear [the boy yelling ""I'm going to kill you""]. I mean with the el noise.",47-j9,"I don't think he could have heard [the boy yelling ""I'm going to kill you""].",ARG,46,Act2-TwelveAngryMan,SUPPORT,,ENTAILMENT,
49-j3,"[The old man cannot be a liar, he must have heard the boy yelling ""I'm going to kill you""].",48-j2,"Maybe he didn't hear [the boy yelling ""I'm going to kill you""]. I mean with the el noise.",ARG,47,Act2-TwelveAngryMan,ATTACK,CONTRADICTION,,
50-j5,"It stands to reason, [the old man can be a liar].",49-j3,[The old man cannot be a liar].,ARG,48,Act2-TwelveAngryMan,ATTACK,CONTRADICTION,,
51-j9,"Attention, maybe [the old main is a liar].",50-j5,"It stands to reason, [the old man can be a liar].",ARG,49,Act2-TwelveAngryMan,SUPPORT,,ENTAILMENT,
52-j9,"He was a very old man with a torn jacket, and he carried two canes. This is a quiet, frightened, insignificant man who has been nothing all his life, who has never had recognition—his name in the newspapers. A man like this needs to be recognized. To be questioned, and listened to, and quoted just once.",51-j9,"Attention, maybe [the old main is a liar].",ARG,50,Act2-TwelveAngryMan,SUPPORT,,ENTAILMENT,
53-j9,"The old man wouldn't really lie. But perhaps he'd make himself believe that he heard those words and recognized the boy's face. [He wore a torn jacket, and he carried two canes. He is an insignificant man who has been nothing all his life and needs to be recognized].",52-j9,"He was a very old man with a torn jacket, and he carried two canes. This is a quiet, frightened, insignificant man who has been nothing all his life, who has never had recognition—his name in the newspapers. A man like this needs to be recognized. To be questioned, and listened to, and quoted just once.",ARG,51,Act2-TwelveAngryMan,SUPPORT,,ENTAILMENT,
54-j3,That's the most fantastic story I've ever heard. You made it up.,53-j9,The old man wouldn't really lie. But perhaps he'd make himself believe that he heard those words and recognized the boy's face.,ARG,52,Act2-TwelveAngryMan,ATTACK,UNKNOWN,,
55-j8,"I think we proved that the old man couldn't have heard the boy say, ""I'm going to kill you"" but supposing he really did hear it? This phrase: how many times has each of you used it? Probably hundreds. ""If you do that once more, Junior, I'm going to murder you."" ""Come on, Rocky, kill him!"" We say it every day. This doesn't mean that we're going to kill someone.",41-j3,"The old man heard the kid yell, ""I'm gonna kill you."" A second later he heard the father's body falling, and he saw the boy running out of the house fifteen seconds after that.",ARG,53,Act2-TwelveAngryMan,ATTACK,CONTRADICTION,,
56-j3,"The phrase was ""I'm going to kill you"" and the kid screamed it out at the top of his lungs. Anybody says a thing like that the way he said it — they mean it.",55-j8,"I think we proved that the old man couldn't have heard the boy say, ""I'm going to kill you"" but supposing he really did hear it? This phrase: how many times has each of you used it? Probably hundreds. ""If you do that once more, Junior, I'm going to murder you."" ""Come on, Rocky, kill him!"" We say it every day. This doesn't mean that we're going to kill someone.",ARG,54,Act2-TwelveAngryMan,ATTACK,CONTRADICTION,,
57-j10,"And how they mean it [when they say ""I'm going to kill you"", as the boy screamed out at the top of his lungs.]!",56-j3,"The phrase was ""I'm going to kill you"" and the kid screamed it out at the top of his lungs. Anybody says a thing like that the way he said it—they mean it.",ARG,55,Act2-TwelveAngryMan,SUPPORT,,ENTAILMENT,
58-j8,"Do you really think the boy would shout out a [""I'm going to kill you""] so the whole neighborhood would hear it? I don't think so. He's much too bright for that.",56-j3,"The phrase was ""I'm going to kill you"" and the kid screamed it out at the top of his lungs. Anybody says a thing like that the way he said it—they mean it.",ARG,56,Act2-TwelveAngryMan,ATTACK,CONTRADICTION,,
59-j5,I'd like to change my vote to not guilty.,40-j9,It's a feeling I have [that he is not guilty].,ARG,57,Act2-TwelveAngryMan,SUPPORT,,ENTAILMENT,
60-j7,"We're supposed to believe that the old man didn't get up out of bed, run to the door, and see the kid beat it downstairs fifteen seconds after the killing.",45-j8,"An el takes ten seconds to pass a given point or two seconds per car. That el had been going by the old man's window for at least six seconds and maybe more, before the body fell, according to the woman. The old man would have had to hear the boy say, ""I'm going to kill you,"" while the front of the el was roaring past his nose. It's not possible that he could nave heard it.",ARG,58,Act2-TwelveAngryMan,ATTACK,UNKNOWN,,
61-j8,"[We are not supposed to believe that the old man didn't get up out of bed, run to the door, and see the kid beat it downstairs fifteen seconds after the killing]. We're going to find out how a man who's had two strokes in the past three years, and who
walks with a pair of canes, could get to his front door in fifteen seconds.",60-j7,"We're supposed to believe that the old man didn't get up out of bed, run to the door, and see the kid beat it downstairs fifteen seconds after the killing.",ARG,59,Act2-TwelveAngryMan,ATTACK,CONTRADICTION,,
62-j3,"[The man] said [it took him] twenty seconds [to get up out of bed, run to the door, and see the kid beat it downstairs].",61-j8,"[We are not supposed to believe that the old man didn't get up out of bed, run to the door, and see the kid beat it downstairs fifteen seconds after the killing]. We're going to find out how a man who's had two strokes in the past three years, and who
walks with a pair of canes, could get to his front door in fifteen seconds.",ARG,60,Act2-TwelveAngryMan,ATTACK,CONTRADICTION,,
63-j2,"[The man] said [it took him] fifteen seconds [to get up out of bed, run to the door, and see the kid beat it downstairs].",62-j3,"[The man] said [it took him] twenty seconds [to get up out of bed, run to the door, and see the kid beat it downstairs].",ARG,61,Act2-TwelveAngryMan,ATTACK,CONTRADICTION,,
64-j9,"[The man] said [it took him] fifteen seconds [to get up out of bed, run to the door, and see the kid beat it downstairs]. He was very positive about it.",63-j2,"[The man] said [it took him] fifteen seconds [to get up out of bed, run to the door, and see the kid beat it downstairs].",ARG,62,Act2-TwelveAngryMan,SUPPORT,,ENTAILMENT,
65-j3,"He's an old man. Half the time he was confused. He cannot be positive about [the fact that it took him fifteen seconds to get up out of bed, run to the door, and see the kid beat it downstairs]",64-j9,"[The man] said [it took him] fifteen seconds [to get up out of bed, run to the door, and see the kid beat it downstairs]. He was very positive about it.",ARG,63,Act2-TwelveAngryMan,ATTACK,CONTRADICTION,,
66-j11,"[The man] can only walk very slowly, [and he was often confused]. They had to help him into the witness chair. [He could have not got up out of bed, run to the door, and see the kid beat it downstairs in fifteen seconds.]",65-j3,"He's an old man. Half the time he was confused. He cannot be positive about [the fact that it took him fifteen seconds to get up out of bed, run to the door, and see the kid beat it downstairs]",ARG,64,Act2-TwelveAngryMan,SUPPORT,,ENTAILMENT,
67-j3,[Going to the man's front door is not a long walk. He could have get there in fifteen seconds.],66-j11,"[The man] can only walk very slowly, [and he was often confused]. They had to help him into the witness chair. [He could have not got up out of bed, run to the door, and see the kid beat it downstairs in fifteen seconds.]",ARG,65,Act2-TwelveAngryMan,ATTACK,CONTRADICTION,,
68-j9,"For an old man who uses canes, going [to the man's front door] is a long walk.",67-j3,[Going to the man's front door is not a long walk. He could have get there in fifteen seconds.],ARG,66,Act2-TwelveAngryMan,ATTACK,CONTRADICTION,,
69-j8,"It's my guess that the old man was trying to get to the door, heard someone racing down the stairs, and assumed that it was the boy.",41-j3,"The old man heard the kid yell, ""I'm gonna kill you."" A second later he heard the father's body falling, and he saw the boy running out of the house fifteen seconds after that.",ARG,67,Act2-TwelveAngryMan,ATTACK,CONTRADICTION,,
70-j6,"I think that [the old man was trying to get to the door, heard someone racing down the stairs, and assumed that it was the boy] is possible.",69-j8,"It's my guess that the old man was trying to get to the door, heard someone racing down the stairs, and assumed that it was the boy.",ARG,68,Act2-TwelveAngryMan,SUPPORT,,ENTAILMENT,
71-j3,This kid is guilty! He's got to burn! We're letting him slip through our fingers here.,40-j9,It's a feeling I have [that he is not guilty].,ARG,69,Act2-TwelveAngryMan,ATTACK,CONTRADICTION,,
72-j8,You want to see this boy die because you personally want it—not because of the facts.,71-j3,This kid is guilty! He's got to burn! We're letting him slip through our fingers here.,ARG,70,Act2-TwelveAngryMan,ATTACK,UNKNOWN,,
74-j2,That's a difference of six inches [between the boy and his father]. It's a very awkward thing to stab down into the chest of someone who's half a foot taller than you are.,73-j2,[Maybe the boy] is not guilty.,ARG,71,Act3-TwelveAngryMan,SUPPORT,,ENTAILMENT,
75-j3,"Down and in. That's how I'd stab a taller man in the chest, and that's how [the boy did].",74-j2,That's a difference of six inches [between the boy and his father]. It's a very awkward thing to stab down into the chest of someone who's half a foot taller than you are.,ARG,72,Act3-TwelveAngryMan,ATTACK,CONTRADICTION,,
