t/_id,t/__text,h/_id,h/__text,_task,_id,_topic,_BAF,_entailment,_ENTAILMENT,h/_d
76-j5,Anyone who's ever used a switch knife would never have stabbed downward. You don't handle a switch knife that way. You use it underhanded.,75-j3,"Down and in. That's how I'd stab a taller man in the chest, and that's how [the boy did].",ARG,73,Act3-TwelveAngryMan,ATTACK,CONTRADICTION,,
77-j8,"Then he couldn't have made the kind of wound, which killed his father, [since he has been stabbed downward. Since he had used a switch knife before, he would have used it underhanded].",76-j5,Anyone who's ever used a switch knife would never have stabbed downward. You don't handle a switch knife that way. You use it underhanded.,ARG,74,Act3-TwelveAngryMan,SUPPORT,,ENTAILMENT,
78-j5,"He couldn't have [made the kind of wound, which killed his father]. Not if he'd ever had any experience with switch knives.",77-j8,"Then he couldn't have made the kind of wound, which killed his father.",ARG,75,Act3-TwelveAngryMan,SUPPORT,,ENTAILMENT,
79-j7,I'm changing my vote to not guilty.,73-j2,[Maybe the boy] is not guilty.,ARG,76,Act3-TwelveAngryMan,SUPPORT,,ENTAILMENT,
80-j10,"[This kid is not innocent.] Look, you know how those people lie. They don't know what the truth is. And lemme tell you, they don't need any real big reason to kill someone either. You know, they get drunk, and bang, someone's lying in the gutter.",79-j7,I'm changing my vote to not guilty.,ARG,77,Act3-TwelveAngryMan,ATTACK,UNKNOWN,,
81-j4,"I still believe the boy is guilty of murder. To me, the most damning evidence was given by the woman across the street who claimed she actually saw the murder committed.",73-j2,[Maybe the boy] is not guilty.,ARG,78,Act3-TwelveAngryMan,ATTACK,UNKNOWN,,
82-j3,"As far as I'm concerned, [the woman across the street who claimed she actually saw the murder committed] is the most important testimony [of the boy's guilt].",81-j4,"I still believe the boy is guilty of murder. To me, the most damning evidence was given by the woman across the street who claimed she actually saw the murder committed.",ARG,79,Act3-TwelveAngryMan,SUPPORT,,ENTAILMENT,
83-j8,"[The woman] wasn't wearing [her glasses] in bed. She testified that in the midst of her tossing and turning she rolled over and looked casually out the window. The murder was taking place as she looked out, and the lights went out a split second later. She couldn't have had time to put on her glasses. Now maybe she honestly thought she saw the boy kill his father. I say that she saw only a blur.",82-j3,"As far as I'm concerned, [the woman across the street who claimed she actually saw the murder committed] is the most important testimony [of the boy's guilt].",ARG,80,Act3-TwelveAngryMan,ATTACK,CONTRADICTION,,
